{
  "$schema": "https://json-schema.org/draft/2020-12/schema",
  "$id": "1.0",
  "type": "object",
  "title": "Minimum Information about a Tailoring Enzyme/Maturase Data Standard",
  "additionalProperties": false,
  "required": [
    "accession",
    "quality",
    "status",
    "changelog",
    "enzyme",
    "reactions"
  ],
  "properties": {
    "accession": {
      "title": "MITE accession number/identifier.",
      "$ref": "#/$defs/accession"
    },
    "quality": {
      "title": "Track quality of entry.",
      "$ref": "#/$defs/quality"
    },
    "status": {
      "title": "Track status of entry.",
      "$ref": "#/$defs/status"
    },
    "retirementReasons": {
      "type": "array",
      "items": {
        "type": "string"
      }
    },
    "changelog": {
      "title": "Log tracking changes in entry.",
      "$ref": "https://meta.secondarymetabolites.org/schemas/common/changelog.json"
    },
    "enzyme": {
      "title": "(Meta)data about the enzyme described by entry.",
      "$ref": "definitions/enzyme.json"
    },
    "reactions": {
      "title": "One or more reactions associated with enzyme.",
      "type": "array",
      "items": {
        "$ref": "definitions/reactions.json"
      },
      "minItems": 1
    },
    "comment": {
      "title": "Any additional information about this entry",
      "type": "string"
    },
    "attachments": {
      "title": "Additional information as key:value pairs.",
      "type": "object"
    }
  },
  "$defs": {
    "accession": {
      "type": "string",
      "pattern": "^MITE\\d{7,7}$"
    },
    "quality": {
      "type": "string",
      "enum": [
        "questionable",
        "low",
        "medium",
        "high"
      ]
    },
    "status": {
      "type": "string",
      "enum": [
        "pending",
        "embargoed",
        "active",
        "retired"
      ]
    }
  }
}